number,Name,Movie,Popularity,Picture Src,Desciption
61,Frozone,Incredible,common,incredible_frozone_burned.png,"Lucius Best, also known as Frozone, is one of the supporting characters of The Incredibles. He is the best friend and a close ally of Mr. Incredible. He has the ability to create ice and freeze surfaces with his hands. "
62,Incredible,Incredible,common,incredible_incredible_burned.png,"Robert ""Bob"" Parr, also known as Mr. Incredible, is the protagonist of Disney/Pixar's 2004 hit animated feature The Incredibles. He is voiced by Craig T. Nelson. In the film, Mr. Incredible is a person born with superpowers, and is referred to as a ""Super."" He was one of the most famous heroes of his era, and was known for his skill at fighting crime. At some point, he met and fell in love with fellow superhero Elastigirl. However, soon after the two wed, bystanders who had been injured during crime-fighting attempts began to sue. "
63,Syndrome,Incredible,uncommon,incredible_syndrome_burned.png,"Syndrome (real name Buddy Pine) is a supervillain, and the main antagonist in the Disney/Pixar 2004 film, The Incredibles. As a young Buddy Pine, the boy who would become Syndrome aspired to become a superhero and this goal led him to beg Bob Parr to hire him as a sidekick, ""Incredi-boy!"". Sadly, after Bob categorically refused to grant Buddy's favor, Buddy returned home in disgrace and rejected the righteous path. He became embittered and eventually descended into megalomania. "
64,Violet Parr,Incredible,common,incredible_violetparr_burned.png,"Violet Parr is one of the two tritagonists in the Disney/Pixar animated film The Incredibles, along with her younger brother Dash. She has one more brother, Jack-Jack, and is the only daughter of Bob Parr and Helen Parr. As a child of superheroes, she has superhuman powers herself; she can make herself partly or completely invisible or create a force field around herself or in some distance."
65,Anger,Inside Out,uncommon,inside_out_anger.png,"Anger is one of the five emotions controlling Riley Andersen's mind. He lives in her brain and works with the other emotions. When Joy and Sadness literally get lost in Riley's mind, he and the others have to keep Riley's head on straight until they get home. Next to Joy, he may be the most abrasive to Sadness."
66,Bing Bong,Inside Out,common,inside_out_bing_bong_burned.png,"Bing Bong was Riley's imaginary friend created during her early childhood. However, as Riley grew older, she stopped playing with him, leaving Bing Bong out of a job and a bit lonely. Drifting around Long Term Memory unbeknownst to the other mental denizens, he collected happy memories he liked into a bottomless bag. He greatly missed the times he shared with Riley and was desperate to not be forgotten until one day when he is discovered by the misplaced emotions Joy and Sadness, who were accidentally ejected from Headquarters. Afraid of their sudden appearance, Bing Bong initially tried to run, but when Joy presents herself, he is thrilled to meet her."
67,Disgust,Inside Out,uncommon,inside_out_disquist.png,"Disgust is highly opinionated, extremely honest and prevents Riley from getting poisoned — both physically and socially. She keeps a careful eye on the people, places and things that Riley comes into contact with — whether that's broccoli or last year's fashion trend. Disgust always has the best of intentions and refuses to lower her standards."
68,Fear,Inside Out,common,inside_out_fear.png,"Fear's main job is to protect Riley and keep her safe. He is constantly on the lookout for potential disasters, and spends time evaluating the possible dangers, pitfalls and risk involved in Riley's everyday activities. There are very few activities and events that Fear does not find to be dangerous and possibly fatal."
69,Joy,Inside Out,uncommon,inside_out_joy.png,"Joy is the protagonist of the 2015 Disney/Pixar film Inside Out. She is one of the five emotions inside the mind of Riley Andersen. She always strives to remain joyful, hence her name, and is the leader of Riley's emotions. Joy's goal has always been to make sure Riley stays happy. She is lighthearted, optimistic and determined to find the fun in every situation. Joy sees challenges in Riley's life as opportunities, and the less happy moments as hiccups on the way back to something great. As long as Riley is happy, so is Joy"
70,Rainbow Unicorn,Inside Out,super rare,inside_out_rainbowunicorn.png,"Rainbow Unicorn is an actress and works at Dream Productions. She has starred in a dream sequence titled Fairy Dream Adventure, Part 7. Joy loves Rainbow Unicorn in this production."
71,Sadness,Inside Out,common,inside_out_sadness.png,"None of the other Emotions really understand what Sadness's role is. Sadness would love to be more optimistic and helpful in keeping Riley happy, but she finds it so hard to be positive. Sometimes it seems like the best thing to do is just lie on the floor and have a good cry."
72,Crane,Kung Fu Panda,common,kung_fu_crane_burned.png,"Master Crane is one of the supporting characters of the Kung Fu Panda franchise. He is a member of the Furious Five as well as one of Master Shifu's students at the Jade Palace. He is a master of the Crane Style of kung fu.Crane previously worked as a janitor at the Lee Da Kung Fu Academy, where his keen skill was noticed by its star pupil, Mei Ling. Though lacking confidence at first, he passed the school tryouts and proved his kung fu capabilities, and later formed the Furious Five with Tigress, Mantis, Monkey, and Viper."
73,Mantis,Kung Fu Panda,rare,kung_fu_mantis_burned.png,"Master Mantis is one of the supporting characters of the Kung Fu Panda franchise. He is a member of the Furious Five as well as one of Master Shifu's students at the Jade Palace. He is a master of the Mantis Style of kung fu.A warrior from an early age, Mantis had a fast-paced attitude that led him into trouble when he was captured by the Wool Stealing Crocodile Bandits. Forced to stay still for many days, he learned the patience needed to free himself. After learning this kung fu discipline, he eventually came to form the Furious Five with Tigress, Monkey, Viper, and Crane. Upon meeting Po, he made light of the panda being the Dragon Warrior, but was one of the first to relate to him. He now fights alongside Po as a friend and ally. "
74,Monkey,Kung Fu Panda,common,kung_fu_monkey.png,"Master Monkey is one of the supporting characters of the Kung Fu Panda franchise. He is a member of the Furious Five as well as one of Master Shifu's students at the Jade Palace. He is a master of the Monkey Style of kung fu.In his youth, Monkey was known as a thief and prankster who made a fool of anyone called to get rid of him— until Master Oogway arrived. After he lost a battle against the old master, Monkey was convinced by Oogway to find a new purpose: to use his skills for good."
75,Po,Kung Fu Panda,uncommon,kung_fu_po_burned.png,"Master Po Ping (known simply as Po) is the main protagonist of the Kung Fu Panda franchise. He is the adopted son of Mr. Ping as well as one of Master Shifu's students at the Jade Palace. He is also the foretold Dragon Warrior of legend, and a master of the Panda Style of kung fu.Originally born in a farming village to his birth parents, Po was separated from his family as a result of the massacre of the pandas. He was eventually found by Mr. Ping, who adopted him, hoping for Po to inherit the family noodle shop some day. However, Po was drawn to kung fu, and his unwavering enthusiasm led him to be chosen as the Dragon Warrior, after which he began training under Master Shifu. "
76,Master Shifu,Kung Fu Panda,common,kung_fu_shifu_burned.png,"Master Shifu is one of the main supporting characters of the Kung Fu Panda franchise. He is the current senior master of the Jade Palace and trainer of many kung fu warriors, including Po (the Dragon Warrior), the Furious Five, and Tai Lung.

A former student of Master Oogway, Shifu became a highly skilled master of kung fu who hoped that his first student, Tai Lung, would become the legendary Dragon Warrior. Some time after Tai Lung's betrayal, however, Shifu went on to train Tigress, Mantis, Monkey, Viper, and Crane, the Furious Five. Though these students became well-known for their heroics, none of them were selected to be the Dragon Warrior, and Shifu was outraged when Po was chosen instead."
77,Tai Lung King,Kung Fu Panda,rare,kung_fu_tai_lung_kung_burned.png,"Tai Lung is the main and sole antagonist of Kung Fu Panda. He was the adoptive son and former student of Master Shifu, and a powerful master of the Leopard Style of kung fu.Trained by Shifu at the Jade Palace, Tai Lung was raised under the impression that he was to become the prophesied Dragon Warrior. However, after he was denied the title by Master Oogway, Tai Lung revealed his true dark nature by rampaging the Valley, resulting in his incarceration for twenty years. After breaking out of prison, he sought to claim the Dragon Scroll and take his place as the Dragon Warrior once again, fighting and defeating many warriors in his pursuit."
78,Tigress,Kung Fu Panda,uncommon,kung_fu_tigress_burned.png,"Master Tigress is one of the main supporting characters of the Kung Fu Panda franchise. She is a member of the Furious Five as well as one of Master Shifu's students at the Jade Palace. She is a master of the Tiger Style of kung fu.Tigress first lived at the Bao Gu Orphanage as a child, where she received help in controlling her strength and temper from Shifu, who later took her in as his student. Over the years, she trained under Shifu's strict instruction, developing into a powerful fighter and forming a stern personality. Eventually she became a member of the Furious Five along with Mantis, Viper, Monkey, and Crane. "
79,Viper,Kung Fu Panda,common,kung_fu_viper_burned.png,"Master Viper is one of the supporting characters of the Kung Fu Panda franchise. She is a member of the Furious Five and the daughter of Great Master Viper, as well as one of Master Shifu's students at the Jade Palace. She is a master of the Viper Style of kung fu.On the day of her birth, Viper's parents were disappointed to find that she had no fangs, seeing this as a sign that she could not become a warrior. As a child, she became a talented ribbon dancer, which came to use when she ended up saving her father from a gorilla bandit. With her skill made apparent, Viper eventually grew into a kung fu master and formed the Furious Five with Tigress, Mantis, Monkey, and Crane."
80,Kovalski,Madagascar,super rare,madagascar_covalski_burned.png,"Ranked as Second-In-Command as Skipper's Lieutenant, Shock Unit (Mr. )Kowalski is the smartest, tallest (if unusually small for his species) and presumably either the second oldest of the Penguins- or possibly the same approximate age as Skipper. Kowalski forms plans for the group and usually takes notes for Skipper. His knowledge has allowed him to take up positions where his intelligence is needed, such as being the team's medic as well as chief scientist and inventor. He tends to unnecessarily over-analyze simple situations. "
81,King Julian,Madagascar,rare,madagascar_kingjulian_burned.png,"As the self-proclaimed ""Lord of the Lemurs"", King Ringtail Julien XIII ruled over a great colony of lemurs in Madagascar with charisma and certainly little ability to lead. It's a goof for Julien to be a king since male ring tails are not leaders (although in the movie Maurice said he was ""self-proclaimed"" lord of the lemurs). Julien had parties for his people on Madagascar with much frequency, the likes of which were interrupted constantly by the Fossa, which trespassed onto the lemur villages, interrupting their parties, ripping their limbs off, stealing their women and devouring all that they could catch."
82,Marty,Madagascar,common,madagascar_marty_burned.png,"Marty is the deuteragonist of the film series but the tritagonist of Madagascar 3: Europe's Most Wanted. He is a zebra which lived at the Central Park Zoo, and a good friend of Alex. In the beginning, Marty lived a life of comfort in the zoo, but comfort led to boredom and Marty soon saw that his tenth birthday came and went and with that, his life was halfway in. Marty decided, then, that he must travel to the wild, for at least a short time, never having seen the wild. At one point in the movie, Alex says he's black with white stripes, as he has 30 black, and only 29 white, but this was partly due to the fact that Alex had to give an explanation as to why he was licking Marty, as he thought he was the steak in his dream."
83,Melman,Madagascar,common,madagascar_melman_burned.png,"Melman is a half-anthropomorphic giraffe who appears in Madagascar (in which he is the tritagonist). He is somewhat of a hypochondriac, having doses of medicine for meals and doctor's appointments frequently. He even complains about having brown spots on his neck. "
84,Maurice,Madagascar,common,madagascar_mourice_burned.png,"Maurice is an Aye-Aye lemur, and King Julien's adviser and right-hand man. He usually thinks King Julien is bizarre (which is true), but he also loves dancing and parties, assisting the King with his crazy and selfish plans, and is entirely loyal to him. Maurice had a major role in the first episode, Gone in a Flash. He is the least seen and heard of the Lemurs.Even though he is on the Lemurs side like Marlene he has shown being neutral and being on the penguins side. When the penguins need a five man team,they get Marlene, When they need a six man team,they get her and him. "
85,Private,Madagascar,common,madagascar_private_burned.png,"Private is the youngest, shortest, chubbiest, and the most inexperienced member of the team. Despite his inexperience, sometimes he is the only penguin able to resolve the main issue (episode) in the series. He is able to reach an end that has both parties in a 'win-win' situation (giving Barry a hug and making the rest Zoo forget the penguin's spying on them, even his own team). In Eclipsed, King Julien states that Private is the nicest animal in the zoo. However, he is an excellent fighter (he was easily able to defeat Skipper in a training session in The Hidden)"
86,Rico,Madagascar,uncommon,madagascar_rico.png,"Rico is the head of demolition and storage for the Penguins. He has feathers resembling a Mohawk on his head and a scar across the left side of his beak, but it is unknown how he got it, since he didn't have it in the first three Madagascar movies. It is shown in A Christmas Caper, which (presumably) took place before the movies, but does not appear in the movies at all.Rico holds a variety of items in his gut, which is a virtual 'hammerspace' as many of those items are bigger than him. While inside his digestive system, Mort finds a spiral staircase and an elevator. In The Big S.T.A.N.K., he choked up an air-to-ground missile and launching platform. In The Red Squirrel, it was a ringing payphone."
87,Skipper,Madagascar,common,madagascar_skipper.png,"Skipper Skip-king is the leader of a band of penguins bent on a secret agenda of escaping the confines of the zoo and being free in Antarctica. He is the second shortest and chubbiest of the group (Only Private is shorter and chubbier) and he has ice blue eyes. It is probable that Skipper and the rest of his squad are warm climate penguins, for they do not live in an air-conditioned habitat. This is supported in one episode, where the city was having one of the coldest days ever, and the penguins used heat lamps to warm up their habitat, and also in the movie where the penguins aren't bothered by the warmth of Africa and Madagascar, but intensely dislike Antarctica."
88,Alex,Madagascar,common,madagasckar_alex_burned.png,"Alex is an African lion and was the self-proclaimed king of the zoo. Alex's birthday is November 30.Alex loves the zoo and was surprised when hearing Marty's wish to leave and live in the wild. As the main attraction of the zoo, he is featured heavily on merchandise and gives an ""Alex the Lion"" snow globe and other merchandise to Marty for his birthday. He also shows an infatuation with steak, though later remarks that sushi tastes better. "
89,Mort,Madagascar,common,madagasckar_mort_burned.png,"Mort is a cute and sort-of-innocent mouse lemur. He is somewhat bothersome toward the other zoo animals. While the character he admires and reveres, King Julien, dislikes him the most, the zoo inhabitants dislike Julien and care more for Mort (although not by much). He loves King Julien's feet which started when he saw King Julien using them to kick some Fossa in the first episode of All Hail King Julien. In fact, he loves his feet so much that he can rip down a tree while sleeping for them, as seen in ""Two Feet High and Rising."" King Julien also hates it when Mort touches his feet. "
90, Hal Stewart,Megamind,uncommon,megamind_hal_stewart_burned.png,"Hal Stewart was Roxanne Ritchi's cameraman with an obsessive crush on her. Hal appears to live an unhappy life in a tiny one bedroom apartment with the mindset of an immature college student. His constant misfortune and inability to earn people's respect and affection cause him to despise life, even his records say he's never accomplished anything. "
91,Megamind,Megamind,common,megamind_megamind_burned.png,"Megamind is the main protagonist from the titular movie Megamind. He is a former supervillain who is Roxanne's love interest. His former evil plans were constantly botched by Metro Man. As a baby, Megamind was placed in a pod like Metro Man to be saved from The Black Hole that swallowed his planet. He and Metro Man landed on Earth. He was raised in a prison. The prisoners taught Megamind all about what's right and wrong using Baby Supervillains cards. These cards are similar to the, ""Baby Einstein"" cards. "
92,Metro Man,Megamind,rare,megamind_metro_man_burned.png,"Metro Man is the superhero of the Movie Megamind. He has superstrength, flying, laser vision powers, invulnerability, and great hair. After Megamind, Minion, and Metro Man's home planets were pulled into a black hole, they were the only survivors of the two worlds. They were both launched off-planet in rockets, and collided, and Megamind told that was the day his rivalry with ""Mr. Goodie-Two-Shoes"" began. Metro Man landed in a house, in which the couple living there adopted him. Megamind crashed in the Metro City Prison and was raised by prisoners. "
93,Minion,Megamind,uncommon,megamind_minion_burned.png,"Minion is a character that appeared in Megamind. He was voiced by David Cross and he is Megamind's henchman. His appearence is a robot with a fish inside a dome of water. His body, arms, and legs are that of a gorilla. When he was a baby fish, he is in a fluid filled ball. In the present, he calls Megamind ""sir."" He and Megamind used Hal Stewart as the hero-turned-villian, Titan. He loves Megamind, but Megamind is bored because he missed Metro Man, everyone's biggest hero. Minion decided he should make Megamind feel better. "
94,Roxanne,Megamind,common,megamind_roxanne_ritchi_burned.png,"Not much is known about Roxanne's early life except that she used to go bike riding with her mother at the Metro City Park in her youth and that she used to be best friends with a girl named Vida in middle school. She is a not-so dim-witted reporter who is the favorite victim of Megamind's kidnapping schemes to defeat Metro Man, believing that the two are a celebrity couple. She has actually been kidnapped so many times that she has become quite casual about the whole ordeal. Even going as far as to try to get in an interview with Minion during one of these kidnappings. "
95,Boo,Monsters,common,monsters_boo_burned.png,"In the first film, Boo is a 2-year-old human child who has escaped from her room from which Randall intended to kidnap her. Much of the film's plot follows what happens as Sulley and Mike try to get Boo back to safety. "
96,Fungus,Monsters,rare,monsters_fungus_burned.png,"Jeff Fungus is the secondary antagonist of Monsters, Inc. He is Randall's scare coach and assistant at Monsters, Inc. He is a small, red monster with three eyes and two legs similar to those of a chicken. He wears three-lensed glasses. In the film, Fungus is Randall's scare assistant. He is rather cowardly and wimpy, due to the wrathful temper of Randall, and helps him with his plot to revolutionize the scaring industry, although he regrets it."
97,George,Monsters,common,monsters_george_burned.png,"George Sanderson is a character in Monsters, Inc. and its prequel Monsters University. He is a monster that runs afoul of the CDA's ""Code 2319"" (contact with a human child) several times, forcing the CDA to shave and scrub him to remove any trace of human contact. "
98,Henry,Monsters,uncommon,monsters_henry_burned.png,"Waternoose is a large obese gray monster, completely bald, with five eyes, and walks around on a set of six crab-like legs. He is always seen wearing a black tuxedo jacket over a white shirt, a red vest, and a black bow tie. When he was younger, he had an Afro-style hair and a chinless beard. A producer described him as a ""cross between a spider and a crab."" Although Waternoose is an antagonist in this movie, he doesn't reveal his true colors until near the climax. Until then, he has a gentle, fatherly facade and is only driven to villainy out of desperation to keep Monsters, Inc. afloat in the midst of the energy crisis. "
99,James,Monsters,common,monsters_james.png,"James ""Jimmy"" P. ""Sulley"" Sullivan is the protagonist of Monsters, Inc. and the deuteragonist of its prequel Monsters University. He is a huge monster with shaggy blue fur with purple spots, two small horns on his head, and a long tail. In the first film, Sulley was top scarer of Monsters, Inc., and was naturally afraid of humans, due to their rumored ""toxic touch"" that could kill the biggest monsters in an instant...until he met Boo, a human girl who found her way into the monster world and into the factory. Sulley, who was initially hesitant, became Boo's protector and obtained a fatherly role to the human."
100,Mike Wazowski,Monsters,uncommon,monsters_mike.png,"Mike Wazowski is a proud and confident monster, partly defined by his friendship with James P. Sullivan, whom he works with as his Scaring Assistant, and drives him through an exercise regimen like a strict coach. They're best friends, room-mates, incredibly devoted to each other, although Mike seeks to improve their careers, partly because of the hard work and everything they've ever put into their jobs. He tried really hard to make sure they won the Olympic games so that he could prove he was able to be there. He is very confident and brave. "
101,Randall Boggs,Monsters,rare,monsters_raindall_boggs.png,"In Monsters University, Randall was originally a kind, timid teenage monster who would hang out with Mike. However, after Mike was forced to befriend Sulley and stopped associating with Randall, he felt hurt and this caused him to slowly turn on Mike and become his new enemy, even though he kinda betrayed Mike in the first place.In Monsters, Inc., Randall is greedy, ruthless, sneaky, short-tempered, and overall evil in nature. As well, Randall is something of a selfish jerk who dosen't care about a lot of people. Judging by his intentions to capture children for their screams (and possibly never return them), he is probably willing to severly harm even little kids. "
102,Yeti,Monsters,common,monsters_yeti_burned.png,"The Yeti is a monster who worked at Monsters, Inc. until he got banished (presumably for tampering with mail) to the Himalayas. Despite this, he enjoys living in the human world."
103,Bloat,Nemo,common,nemo_bloat_burned.png,"Bloat is a porcupine pufferfish in Finding Nemo. He was bought by the dentist from ""Bob's Fish Mart.""Bloat is a porcupine pufferfish who lives in Philip Sherman's office tank. When he gets scared or agitated, he bloats up, and then one of the other fish has to deflate him.In the ending of the film, Bloat and the rest of the Tank Gang escape the aquarium exactly as Gill had planned, but Bloat then asks, ""Now what?"" ending the gang's joy of escape and causing them to worry about how they will get out of their plastic bags. "
104,Bruce,Nemo,uncommon,nemo_bruce_burned.png,"Bruce is a great white shark in Finding Nemo. He is the leader of the Fish-Friendly Sharks.Bruce is a kind and pleasant shark. He is also shown to be jolly, laid-back, and a jokester. However, his personality changes when his instincts start to kick in, and this makes him turn into a mindless, fish-eating shark (temporarily)."
105,Bubbles,Nemo,common,nemo_bubbles_burned.png,"Bubbles is a character in Finding Nemo. He was bought by the dentist from a store called ""Fish-o-rama."" Bubbles is a hyperactive yellow tang fish. He has a peculiar obsession over the bubbles that come out of a small treasure chest decoration in the fish tank; hence his name. He eventually escapes with the rest of the tank fish into the ocean. During the credits, Bubbles notices some bubbles that appear at one end of the screen and chases after them."
106,Dory,Nemo,super rare,nemo_dory_burned.png,"Throughout the vast ocean you will not find a fish more hospitable, more friendly, and more sociable than Dory. She would love to chat with you all day and tell you her life story... but she can't. Dory suffers from short term memory loss. Dory is the aquatic Good Samaritan who offers to help Marlin on his journey to find his son. She is certainly an odd partner for such a quest, but her optimism proves an invaluable quality to help overcome the impossible. To Dory, the glass is always half-full"
