number,Name,Movie,Popularity,Picture Src,Desciption
107,Gill,Nemo,uncommon,nemo_gill_burned.png,"Gill is a moorish idol in Finding Nemo. He is the leader of the Tank Gang. Gill's only dream is to escape from the tank. He had made several escape attempts, but the first time, he landed on dental tools, giving him severe scars on his right side, and destroying his right fin. His appearance is modeled after the voice actor who does his voice, especially the coloring around his mouth to show the deep wrinkles that Dafoe has on his face. "
108,Jacques,Nemo,common,nemo_jacques_burned.png,"Jacques is a French-accented shrimp in Finding Nemo and Finding Dory. Jacques ""decontaminates"" new fish to the tank in the dentist's office. He also controls the ""Ring of Fire"" on Mount Wannahockaloogie, as seen when Nemo was given a royal welcome by the Tank Gang, who dubbed him ""Sharkbait"" after he successfully swam through the ""Ring of Fire."" Later, Jacques activates the ""Ring of Fire"" again for Gill, who shoots out of the tank and lands on Darla's head (which distracts her while she was shaking the bag that Nemo was in) to save Nemo from becoming Darla's next victim, like her previous fish Chuckles. "
109,Nemo,Nemo,rare,nemo_nemo_burned.png,"Nemo is a curious and impressionable six-year-old boy who lives alone with his overprotective, single-parent father, Marlin. Having led a sheltered life, Nemo brims with the excitement of starting school and finally seeing the wonders of the Great Barrier Reef. Despite being born with a withered fin, Nemo yearns for adventure, and as fate takes him far from home, he learns he is capable of doing great things... like his father"
110,Nigel,Nemo,uncommon,nemo_nigel_burned.png,"Nigel is a brown pelican and one of the supporting characters in Finding Nemo. Nigel was friends with the Tank Gang, and also met Nemo after he ended up joining them (due to being taken from his habitat by the dentist). However, he is usually driven out by the dentist shortly thereafter. Nigel later told Nemo about his dad Marlin's attempt to find Nemo after hearing it from his pelican friends, which gave Nemo a new drive at sabotaging the filter. He is also annoyed by the Seagulls. "
111,Peach,Nemo,common,nemo_peach_burned.png,"Peach is a character in Finding Nemo. She was purchased by the dentist on eBay. Peach is a pink-red starfish who can apparently read human. She is usually seen attached to the side of the tank and watching the dentist do his dental work on different patients. She announces what is going on to the rest of the Tank Gang; however, whenever Peach speaks, her voice is muffled against the glass (which is a running gag) and one of the other fish would say, ""Can't hear you, Peach."" She then unsticks herself from the glass so the gang can hear her clearly. At "
112,chef Skinner,Ratatouille,uncommon,ratatouille_chef_skinner_burned.png,"Skinner (also known as ""Chef Skinner"") is the main antagonist in Ratatouille. Skinner is the head chef of the famous restaurant Gusteau's. He was sous-chef under Gusteau but became the head chef after Gusteau's sudden death. In Gusteau's will, it was stated that Skinner would inherit Gusteau's business interests if no heir appeared within two years after the latter's death. Skinner evidently did not hold Gusteau's ideals in the highest regard, and was more interested in personal profit from his line of Chef Gusteau's Frozen Foods. "
113,Colette,Ratatouille,uncommon,ratatouillie_colette.png,"Colette Tatou is the tritagonist of Ratatouille. Colette is the only female cook in Chef Skinner's kitchen at Gusteau's. She is a capable cook, hard working and very tough to enter the masculine world of haute cuisine. She had defended Linguini from being fired as a garbage boy when Skinner caught him ""cooking"" the soup in which Remy had made."
114,Django,Ratatouille,rare,ratatouillie_django_burned.png,"Django is the father of Remy and Emile, as well as the leader of the rat colony.His son Remy is gifted with a keen understanding of cuisine, which Django really doesn't understand, as well as a powerful sense of smell and taste. Django notices his son's gift of a strong smell when Remy grabs a poisonous apple core away from in which he was going to eat. Because of this, Django gives his son the job of sniffing for rat poison. "
115,Emile,Ratatouille,common,ratatouillie_emile_burned.png,"Emile is Remy's older brother in the film Ratatouille. He is a brown (his mother's fur color), overweight rat, who is slightly larger than his younger brother. He is friendly, understanding, and is the only one whom Remy tells about his cooking, TV watching, and reading talent. He never tells their dad Django, due to his brotherly support to Remy (although he did carelessly tell his friends about Remy's activities inside Gusteau's). Emile loves food; however, he often swallows food whole and, to Remy's disappointment, doesn't savor the flavors. "
116,Gusteau,Ratatouille,uncommon,ratatouillie_gusteau_burned.png,"He is a renowned and extremely talented chef who wrote the bestseller Anyone Can Cook and founded the restaurant Gusteau's, which merited five stars. His personal motto is that anyone can cook, and is prone to producing recipes with unusual flairs. He was the youngest chef in history to obtain a 5-star restaurant, and was among the finest chefs worldwide. "
117,Alfredo Linguini,Ratatouille,common,ratatouillie_linguini.png,"Linguini is the son of Auguste Gusteau and Renata Linguini. He knows nothing about cooking, which can be seen from the many Chinese take-out cartons in his refrigerator and his lack of cooking skills and knowledge. He is attracted to Colette, the only female cook in the kitchen. "
118,Remy,Ratatouille,rare,ratatouillie_remy_burned.png,"Remy is the protagonist of Ratatouille. He is a teal, average-sized rat who dreams of being a chef. In the beginning of the film, it is revealed that Remy possesses a very strong sense of smell, able to deduce various ingredients in food. His brother Emile is readily impressed, while his father, rat clan chief, is not but pleased when Remy is assigned as rat poison checker when he almost ate a poisoned apple core, sniffing every bit of garbage for poison, despite the fact that job is essential for the survival of the rat clan. Remy's father is also annoyed about Remy's attitude towards eating garbage, Remy claims that is unhealthy for rats and they ought to try to take the good food found in the kitchens and pantries of the humans."
119,Donkey,Shrek,common,shrek_donkey_burned.png,"Donkey is the deuteragonist of the Shrek franchise. He is Shrek's best friend and sidekick, Dragon's husband, and the Dronkeys' father.Donkey is a hyperactive, talkative, funny, sensitive donkey. He enjoys singing, idle chatter and often speaks ebonics, but proves to be rather annoying to those around him (especially Shrek). Being a donkey, he has a sweet tooth and enjoys such foods as parfait, cake, waffles (his favorite) and ""upside-down coconut souffle with mango chutney sauce"", has acrophobia, colorblindness, hypochondria (fear of illness), cowardice, impatience and short attention span, is often innocent and tactless, and even a bit dim. In a scene about Merlin's bonfire, Donkey's sweet tooth gets the best of him, for he sees only a fudge torte in the enchanted smoke. "
120,Fionna,Shrek,super rare,shrek_fiona_burned.png,"Princess Fiona of Far Far Away is one of the main characters in the Shrek franchise. She is Shrek's wife, Arthur's cousin, and King Harold and Queen Lillian's daughter. Fiona is initially portrayed as the archetypal princess from fairy tales, speaking formally in matters of courtship and presenting high expectations of how she is to be rescued, who is to rescue her, and so forth. Later, Princess Fiona's true self emerges, as she is really a very down-to-earth and independent woman who is a match for or even better than Shrek when it comes to the bad habits he has. She is a loyal friend, and unlike princesses of fairy tales, an expert in hand-to-hand combat with knowledge of Japanese martial arts. She also has very bad manners (just like Shrek), since she is an ogre."
121,Puss in Boots,Shrek,common,shrek_pussy_burned.png,"Puss in Boots is a fictional cat and a supporting character in the Shrek film series, as well as the primary protagonist of the 2011 spin-off prequel Puss in Boots.Recommended to King Harold by Doris (the Ugly Stepsister and barmaid of the Poison Apple Pub) as a famous Ogre Killer, Puss is hired by the king to assassinate Shrek. However, unlike his fairy tale counterpart, he does not try to trick the ogre into changing into a mouse, but instead makes a direct, frontal assault on Shrek, which works up until the feline gags on a hairball, spitting it up. Shrek and Donkey think of what to do with him as Donkey even proposes to give him the ""Bob Barker treatment"", but the swashbuckling cat begs for his life. Puss claims to have taken the contract to help his poor family, consisting of a litter of brothers, a sick mother and a father who lives off garbage. Ultimately, they spare his life, and Puss proposes to the ogre he owes a life debt to him, in thanks."
122,Shrek,Shrek,uncommon,shrek_shrek_burned.png,"Shrek is the titular protagonist of the Shrek franchise. He is Fiona's husband, Donkey and Puss' best friend, and the ogre triplets' father. Shrek lives in a swamp in the middle of the forest by himself. At first, he appears to like being by himself and enjoys scaring people, but not hurting them. Even though his background is unknown, it is assumed that humans think that ogres hurt people even though Shrek isn't violent. "
123,Flynn rider,Tangled,common,tangled_flynn_rider.png,"Eugene Fitzherbert, better known as Flynn Rider, is the deuteragonist in Disney's 2010 animated feature film, Tangled. He is a former thief and the love interest of Rapunzel. "
124,Gothel,Tangled,rare,tangled_gothel.png,"Mother Gothel is the main antagonist of Disney's 50th animated feature film, Tangled. Gothel presents herself with a theatrical flair, often flaunting her beauty and curvaceous appearance with much enthusiasm and dramatics. This ties into the fact that Gothel is a phenomenal actress, dangerous manipulator, and riddled with intelligence. Aside from the magic golden flower she selfishly uses to prolong her life, and her life alone, Gothel lacks magical attributes, relying solely on her intellect to achieve her ambitions. She is also very possessive and selfish, which can easily be seen through the fact that she had been hoarding the magical flower for hundreds of years, which could have, instead, been a gift to share with an ailing world. "
125,Maximus,Tangled,common,tangled_maximus_burned.png,"Maximus (or Max for short), is a supporting character in Disney's 2010 animated film, Tangled. Maximus is described as a dedicated character who will stop at nothing to take down the criminal he is after. Maximus is brave, daring, bold and not at all cowardly, even being more feared than his captain. Maximus is a horse but has a personality more similar to a dog. The character was to be a twist on common Disney horse sidekicks such as Samson from Sleeping Beauty. He is very intelligent, and can not only understand human speech, but can apparently be spoken to, as his facial expressions so obviously confirm"
126,Pascal,Tangled,uncommon,tangled_pascal_burned.png,"Pascal is a supporting character in Disney's 2010 animated feature film, Tangled. He is Rapunzel's pet chameleon, best friend, and confidante. Pascal is a true and loyal friend to Rapunzel. Even though he can't communicate verbally, it is clear that he is one of the driving forces in helping Rapunzel see that she needs to leave the tower. Pascal is constantly cheering her up, rooting her on, and refusing to allow her to take steps backwards. However, even though he cheers her on, he doesn't know much about the outside world either, and despite being just as excited as Rapunzel to experience it, he was originally just as afraid. Since he is a chameleon, he can change color, usually to express his mood with his colors."
127,Pub Thugs,Tangled,common,tangled_pubtugs_burned.png,"When Rapunzel and Flynn Rider (aka Eugene Fitzherbert) arrive at the Snuggly Duckling, a seedy pub filled with thugs, the thugs recognize Flynn from the poster and plan to turn him in, but Rapunzel confronts the men, stating that she needs Flynn to complete her dream of seeing the lights."
128,Rapunzel,Tangled,uncommon,tangled_rapunzel.png,"Rapunzel is the protagonist of Disney's 2010 animated feature film, Tangled. She is a beautiful princess with long, magic, golden hair who, with the aid of the handsome thief, Flynn Rider, leaves her secluded tower to explore the outside world.Rapunzel is loosely based on the classic German fairy tale ""Rapunzel"" by the Brothers Grimm.Rapunzel is the 10th official member of the Disney Princess Royal Court. Rapunzel is a spirited, clever, kind, and adventurous young woman, though a bit naive. However, she is not afraid to stand up for herself or others when the situation calls for bravery. Having spent all of her life isolated in a tower with little else to do, she is proficiently educated in literature, and talented in almost all areas such as music and baking and even more advanced subjects like astronomy, as illustrated by her completely charted astronomical patterns. Her greatest passion is art, as indicated by the pervasive amount of painting on the walls inside the tower. "
129,Aliens,Toystory,rare,toystory_aliens_burned.png,"The Aliens, a.k.a. Squeeze Toy Aliens or Little Green Men (or LGMs for short), are toy aliens with three eyes who appear in Toy Story, Toy Story 2 and Toy Story 3. "
130,Buzz Lightyear,Toystory,common,toystory_buzz_burned.png,"Buzz Lightyear is the deuteragonist of the Toy Story movies, the titular protagonist of its television series, Buzz Lightyear of Star Command, and its direct-to-DVD movie, Buzz Lightyear of Star Command: The Adventure Begins, the protagonist of the Toy Story Toon episode Small Fry, and a supporting character in the Toy Story franchise's other media, Toy Story Treats, Hawaiian Vacation, Partysaurus Rex, Toy Story of Terror!, and Toy Story That Time Forgot.He is a plastic bilingual spaceman action figure who has wings, a laser, a helmet who accomplices Woody on his adventures in each movie.His often repeated catchphrase is: ""To infinity and beyond!"". In a way, Buzz is the co-leader of Andy's toys. "
131,Jessie,Toystory,uncommon,toystory_jessy_burned.png,"Jessie the Yodeling Cowgirl, better known as Jessie, is one of the Toy Story characters introduced in Toy Story 2. She is the tritagonist of both Toy Story 2 and Toy Story 3, and the protagonist of Toy Story of Terror!. She is a pull string cowgirl who was one of Woody's friends on Woody's Roundup (along with Bullseye and Stinky Pete) and later becomes Buzz Lightyear's girlfriend. Jessie is a friendly, excitable cowgirl doll. She likes being loved by any other child and has the power to yodel. She hates being in storage -- as it makes her claustrophobic -- and not having someone to love her. A girl named Emily had once loved her until she gave her up and put her in a charity box, which scarred her for life. "
132,Sheriff Woody,Toystory,common,toystory_sheriffwoody_burned.png,"Woody (a.k.a. ""Sheriff Woody""; full name: Woody Pride) is the protagonist of the Toy Story movies and a supporting character in their spin-off media Toy Story Treats, the Toy Story Toons shorts, Toy Story of Terror! and Toy Story That Time Forgot.He is a pull-string cowboy doll based on a character of the same name from a 1950s children's television series called Woody's Roundup. In each film, Woody leaves Andy's room (where he and the other toys live) and ventures out into the world on an unexpected adventure. He is the leader of Andy's toys and later Bonnie's toys. He was once the favorite toy of a boy named Andy Davis until Andy grew up and gave him to a little girl named Bonnie Anderson. "
133,Slinky,Toystory,rare,toystory_slinky.png,"Slinky Dog (better known as Slinky and often called Slink or Slinkykins) is a supporting character in the Toy Story franchise. He is a toy dachshund with a graveled Southern accent.Slinky possesses a plastic front and hindquarters, with a very stretchable metal slinky as his middle (hence his name), vinyl ears and a green collar. Slinky is a nice, friendly and playful dog. He is quite well-behaved compared with some of Andy's other toys. He shows faith in Woody (sometimes acting like his pet), and he'll do anything to help his friend out. He is friends with all of Andy's toys, has a sense of humor, and enjoys playing checkers with Woody. "
134,Carl,Up,common,up_carl_burned.png,"Carl Fredricksen is the protagonist in Up. He also appeared in Dug's Special Mission as a supporting character and in George and A.J. as a minor character.After Ellie's death, Carl has become lonely, cranky, and bitter and misses his wife terribly. Though with Russell's help he became nicer.Carl has the typical stubborn character of a man his age but deep down he's a kind person, but has his limits in patience and temper. He found Russell, Dug, and Kevin to be annoyances and obstructions in his goal to fulfill Ellie's dream of moving their home to Paradise Falls, but after he read her last message to him, he did what was right and saved Russell and Kevin, and accepted Dug as his dog. "
135,Charles F Muntz,Up,uncommon,up_charlesmuntz_burned.png,"Charles F. Muntz is the main antagonist of Up. At the peak of his career, Muntz was a charismatic, smart and daring young man, whose spirit inspired countless fans to look for adventure.However, Muntz' quest for the bird that caused his disgrace destroyed him, as his search turned to obsession. Now a ghost of his former self, he became a heartless man, consumed by bitterness, paranoid to the extreme, and convinced that anyone who comes across him is after the bird. It is implied he killed two explorers already, and was intending to do the same with Russell and Carl. It is shown that Muntz’ obsession is such that he doesn’t care anymore for the rest of his collection, showing no hesitation to destroy some of his unique specimens when trying to take down Carl. "
136,Dug,Up,rare,up_dug_burned.png,"Dug is one of the two tritagonists of Up. He also appears in Dug's Special Mission as the protagonist, and in George & A.J. as a minor character. Dug is an obese golden retriever who belongs to Charles Muntz. Dug is a playful and friendly dog who is always kind. He likes almost everybody he comes across. He is also very good at following rules and can be somewhat of an airhead at times"
137,Ellie,Up,uncommon,up_ellie_burned.png,Ellie Fredricksen is the deceased wife of Carl Fredricksen in Up. Ellie was Carl's childhood sweetheart and wife. Her idol (along with Carl) was Charles F. Muntz. Her life with Carl and subsequent death were what inspired Carl to embark on his adventure in the film. 
138,Kevin,Up,uncommon,up_kevin_burned.png,"Kevin is one of the two tritagonists of Up. She also appeared in Dug's Special Mission as a supporting character. Kevin is a thirteen foot (3.96 m) tall giant tropical bird of the species that Charles Muntz has been searching for for many years.Russell, who finds the bird along the way, immediately decides to name it ""Kevin"", though it is later revealed that Kevin is actually a female (Russell still calls her ""Kevin"" long after the fact).Apparently, Kevin also likes chocolate as she kept trying to take a bite out of Russell's chocolate bar and can be lured using chocolate.Kevin is eventually captured by Muntz but rescued with the help of Carl, Russell and Dug."
139,Russel,Up,common,up_russel_burned.png,"Russell is the deuteragonist of Up. He also appeared in Dug's Special Mission once again as a supporting character and in George & A.J., this time as a minor character. Russell is an overweight, 8-year old Wilderness Explorer.Russell is a loud, hyperactive, anxious, high-strung, and curious boy. His behavior and personality often annoyed Carl thoughout the movie. That fact that he had chocolate with him suggests that he may like candy, that could also explain why he is overweight. "
140,Auto,Walle,uncommon,walle_auto.png,"AUTO, short for Autopilot, is the main antagonist of Disney/Pixar's 2008 film WALL•E. AUTO's personality resembles much of the personality of HAL 9000 from 2001: A Space Odyssey. As a machine, he shows no kind of emotion and just complies with the orders that have been given to him by the Chairman of Axiom Corporation, through the A113 Protocol. As such, because of his programmed orders, he also can be quite ruthless as to his pursuit of his orders' success, even if it means forcing the human crew to comply against their will."
141,Captain,Walle,common,walle_captain.png,"Captain B. McCrea (or simply The Captain) is one of the two tritagonists in WALL-E, the other being M-O. He is the Axiom's captain and commander. Like the rest of humanity, he was extremely obese, and almost always confined to a hoverchair. Most of the day-to-day management of the ship was handled by Auto and the ship's computer."
142,Eve,Walle,rare,walle_eve.png,EVE (which stands for Extraterrestrial Vegetation Evaluator) is the female lead character and the deuteragonist in the 2008 Disney/Pixar film WALL-E. She is voiced by Elissa Knight. EVE (which stands for Extraterrestrial Vegetation Evaluator) is the female lead character and the deuteragonist in the 2008 Disney/Pixar film WALL-E. She is voiced by Elissa Knight. 
143,GO-4,Walle,uncommon,walle_go_burned.png,"GO-4 (GO-FR) units are robots built by the Buy 'N' Large Corporation tasked with overseeing security operations aboard spacecraft, as well as handling other miscellaneous tasks. It also acts as the secondary antagonist in WALL-E. "
144,M-O,Walle,common,walle_mo_burned.png,"M-O (Microbe-Obliterator) is one of the two tritagonists in WALL•E. He is a robot aboard the Axiom programmed to clean items deemed contaminated. M-O is obsessed of keeping things exempt of ""Foreign Contaminant"", and can do anything to complete this task (an example is when WALL•E teasingly wipes the dirt off one of his treads and covers M-O's face with it, he screams and franctically tries to clean his own face!) He travels around on a single roller, equipped with cleaning tools."
